{
  "machine": {
    "profile": "laptop"
  },
  "notifications": {
    "enabled": true,
    "timeout": 7,
    "timeout_low": 4,
    "timeout_critical": 0,
    "sounds": {
      "enabled": true,
      "critical": "dialog-warning",
      "message": "message-new-instant",
      "system": "service-login"
    }
  },
  "action_center": {
    "sections": [
      "title",
      "buttons-grid#notif_tools",
      "label#status_header",
      "buttons-grid#status_grid",
      "buttons-grid#actions_grid",
      "dnd",
      "mpris",
      "volume",
      "backlight",
      "notifications"
    ],
    "width": 520,
    "height": 720
  },
  "lock_screen": {
    "blur_passes": 4,
    "brightness": 0.72,
    "vibrancy": 0.24
  },
  "wallpaper": {
    "rotate_enabled": true,
    "rotate_interval_minutes": 1440,
    "theme_sync": true
  },
  "panel": {
    "engine": "wayle",
    "visible": true
  },
  "power": {
    "default_profile": "balanced",
    "auto_profile": true
  },
  "animations": {
    "profile": "cinematic",
    "enabled": true,
    "motion_blur": true,
    "motion_blur_samples": 6,
    "border_angle": true,
    "zoom": true,
    "spring": true,
    "window_speed": 7,
    "workspace_speed": 7,
    "workspace_distance": 28,
    "special_workspace_distance": 34
  },
  "input": {
    "kb_layout": "us",
    "touchpad_natural_scroll": true,
    "workspace_swipe": true
  },
  "privacy": {
    "clipboard_history_enabled": true,
    "screenshot_notify": true
  },
  "default_apps": {
    "browser_desktop": "google-chrome.desktop",
    "image_viewer_desktop": "google-chrome.desktop",
    "editor_desktop": "code.desktop"
  },
  "app_routing": {
    "rules": [
      {
        "app": "Discord",
        "priority": "high",
        "route": "both",
        "sound": "message",
        "audio_sink": "default",
        "workspace": "4"
      },
      {
        "app": "NetworkManager",
        "priority": "normal",
        "route": "action-center",
        "sound": "system",
        "audio_sink": "default",
        "workspace": "special:sidepanel"
      }
    ]
  },
  "startup": {
    "nm_applet_autostart": true,
    "blueman_applet_autostart": false,
    "nvidia_settings_autoload": false
  },
  "shortcuts": {
    "open_settings_hub": "SUPER, comma",
    "open_last_settings": "SUPER SHIFT, comma",
    "toggle_settings_quick": "SUPER CTRL, comma",
    "open_settings_panel": "SUPER ALT, comma"
  }
}
